{
    "schema_version": "1.0.0",
    "baseline_id": "governed-architecture-foundation",
    "authority": "Engineering and compatibility evidence subordinate to normative specifications and ratified versioned contracts.",
    "identity": {
        "certified_commit": "77f6a81e6b0a63cc6052fdadb428c719b16c7c61",
        "donor_commit": "d41b0b73fea6c62f7bb32473f190cf4c8c9f14bc",
        "main_commit": "664d08de53565929c8f62379b006cd29f93b239f",
        "certified_branch": "architecture/v4",
        "merge_bases": {
            "certified_donor": "d41b0b73fea6c62f7bb32473f190cf4c8c9f14bc",
            "certified_main": "664d08de53565929c8f62379b006cd29f93b239f",
            "donor_main": "664d08de53565929c8f62379b006cd29f93b239f"
        }
    },
    "specifications": [
        {
            "id": "formal-specification",
            "version": "unversioned-transitional",
            "path": "spec/README.md",
            "authority": "transitional"
        },
        {
            "id": "target-artifact-base",
            "version": "v1",
            "path": "spec/schema/base.schema.json",
            "authority": "versioned-contract"
        },
        {
            "id": "conformance-fixture",
            "version": "v1",
            "path": "spec/schema/conformance-fixture.schema.json",
            "authority": "versioned-contract"
        },
        {
            "id": "pcre2-target",
            "version": "v1",
            "path": "spec/schema/pcre2.v1.schema.json",
            "authority": "versioned-contract"
        },
        {
            "id": "essential-stdlib-registry",
            "version": "1.0.0",
            "path": "spec/stdlib/registry.json",
            "authority": "transitional"
        },
        {
            "id": "strling-package-version",
            "version": "3.0.0",
            "path": "bindings/python/pyproject.toml",
            "authority": "transitional"
        }
    ],
    "fingerprint_algorithm": "sha256 of sorted UTF-8 records: repository path, NUL, lowercase SHA-256 of file bytes, LF; glob patterns expand against the selected source tree",
    "fingerprints": [
        {
            "id": "c-public-api-snapshot",
            "paths": ["governance/contracts/snapshots/c-public-api.json"],
            "sha256": "95a8288966697cf8331b788f1fabccecc1fcca416e7122c973f16a282704f354",
            "source": "certified-commit",
            "role": "public-surface-snapshot",
            "authority": "compatibility-evidence"
        },
        {
            "id": "go-public-api-snapshot",
            "paths": ["governance/contracts/snapshots/go-public-api.json"],
            "sha256": "f7219bec4ae7152a3c87ce2170bc7610b70a68909f69de963de01c3a45e5f60a",
            "source": "certified-commit",
            "role": "public-surface-snapshot",
            "authority": "compatibility-evidence"
        },
        {
            "id": "python-public-api-snapshot",
            "paths": ["governance/contracts/snapshots/python-public-api.json"],
            "sha256": "e17ee6720ae093389e9500c5fe972495f3445ea09995523275fb4627400dd050",
            "source": "certified-commit",
            "role": "public-surface-snapshot",
            "authority": "compatibility-evidence"
        },
        {
            "id": "r-public-api-snapshot",
            "paths": ["governance/contracts/snapshots/r-public-api.json"],
            "sha256": "c49bbaea29df9b79c4d092e0aa1d7c611b1d21ce77e6bbe44a5e1e643ce20f92",
            "source": "certified-commit",
            "role": "public-surface-snapshot",
            "authority": "compatibility-evidence"
        },
        {
            "id": "root-cli-snapshot",
            "paths": ["governance/contracts/snapshots/root-cli.json"],
            "sha256": "999fc23067b1ef224ce475908537bef51d06060a841ff8ad9220757a99c91497",
            "source": "certified-commit",
            "role": "public-surface-snapshot",
            "authority": "compatibility-evidence"
        },
        {
            "id": "schema-conformance-fixture-snapshot",
            "paths": [
                "governance/contracts/snapshots/schema-conformance-fixture.json"
            ],
            "sha256": "a1d080b2137f6b4b9fda9bd9f96a208955915f138891b51eeae8dbea051c371c",
            "source": "certified-commit",
            "role": "public-surface-snapshot",
            "authority": "compatibility-evidence"
        },
        {
            "id": "schema-pcre2-target-snapshot",
            "paths": [
                "governance/contracts/snapshots/schema-pcre2-target.json"
            ],
            "sha256": "5c4d50aef04b2ec767321be40c8f53cdbfeca40e70d35c7531010b42dbd47e15",
            "source": "certified-commit",
            "role": "public-surface-snapshot",
            "authority": "compatibility-evidence"
        },
        {
            "id": "schema-target-artifact-snapshot",
            "paths": [
                "governance/contracts/snapshots/schema-target-artifact.json"
            ],
            "sha256": "8997e331732524bea97623e599732f0af3cc49f81c4b190e5efa1af0b043d2e1",
            "source": "certified-commit",
            "role": "public-surface-snapshot",
            "authority": "compatibility-evidence"
        },
        {
            "id": "typescript-entrypoints-snapshot",
            "paths": [
                "governance/contracts/snapshots/typescript-package-entrypoints.json"
            ],
            "sha256": "2726df2f7ccaf9ab9ee5fb1fba44e356564fc4d89f8be1e9c64d6af5b3027845",
            "source": "certified-commit",
            "role": "public-surface-snapshot",
            "authority": "compatibility-evidence"
        },
        {
            "id": "typescript-public-api-snapshot",
            "paths": [
                "governance/contracts/snapshots/typescript-public-api.json"
            ],
            "sha256": "fbfa175e3058b9a4aacc83dc7478a80d2dd7fce4611d26e28bef16cfc2ab05ad",
            "source": "certified-commit",
            "role": "public-surface-snapshot",
            "authority": "compatibility-evidence"
        },
        {
            "id": "version-synchronized-metadata",
            "paths": [
                "bindings/c/src/strling.c",
                "bindings/cpp/CMakeLists.txt",
                "bindings/cpp/conanfile.py",
                "bindings/csharp/src/STRling/STRling.csproj",
                "bindings/dart/pubspec.yaml",
                "bindings/fsharp/src/STRling/STRling.fsproj",
                "bindings/java/pom.xml",
                "bindings/java/src/main/java/com/strling/Strling.java",
                "bindings/kotlin/build.gradle.kts",
                "bindings/perl/lib/STRling.pm",
                "bindings/php/composer.json",
                "bindings/php/src/STRling.php",
                "bindings/r/DESCRIPTION",
                "bindings/ruby/lib/strling.rb",
                "bindings/ruby/strling.gemspec",
                "bindings/rust/Cargo.toml",
                "bindings/typescript/package.json"
            ],
            "sha256": "eaf38cd37057dd9989b8d139e2469dd07ea7c39bc2ab92904597733466cda965",
            "source": "certified-commit",
            "role": "generated-artifact",
            "authority": "implementation-evidence"
        },
        {
            "id": "swift-compatibility-fixtures",
            "paths": [
                "bindings/swift/Tests/STRlingConformanceTests/Resources/*.json"
            ],
            "sha256": "f8be4945416fd386e71fd587a32279b400e156050c8bdb449f4646d48822a7f9",
            "source": "certified-commit",
            "role": "generated-artifact",
            "authority": "implementation-evidence"
        },
        {
            "id": "formal-specification",
            "paths": [
                "spec/README.md",
                "spec/features.json",
                "spec/grammar/dsl.ebnf",
                "spec/grammar/semantics.md"
            ],
            "sha256": "d0ee71d908f328cba54b3df245f08f18c1f93e0c33dab07630a711c20530a13f",
            "source": "certified-commit",
            "role": "specification",
            "authority": "normative"
        },
        {
            "id": "stdlib-definition",
            "paths": [
                "spec/stdlib/essential_5.json",
                "spec/stdlib/registry.json"
            ],
            "sha256": "49c5904187c40986ee2fdae2246707d011d06e681827a2076a237a2639c118a7",
            "source": "certified-commit",
            "role": "specification",
            "authority": "compatibility-evidence"
        },
        {
            "id": "base-schema",
            "paths": ["spec/schema/base.schema.json"],
            "sha256": "b9e5a959024cd3dc40db7e90cea4bc1bc1991646de2f759ad458f26563bf24cb",
            "source": "certified-commit",
            "role": "schema",
            "authority": "versioned-contract"
        },
        {
            "id": "conformance-fixture-schema",
            "paths": ["spec/schema/conformance-fixture.schema.json"],
            "sha256": "5361dd85994b31592b4e8fe6a51ece421a35b7ccc80ce80ffd301c44bfa44833",
            "source": "certified-commit",
            "role": "schema",
            "authority": "versioned-contract"
        },
        {
            "id": "pcre2-v1-schema",
            "paths": ["spec/schema/pcre2.v1.schema.json"],
            "sha256": "3984ff5063e2563f1ea1f5e6ac7e675e928f5d9c5647c2420e395cfe9531e993",
            "source": "certified-commit",
            "role": "schema",
            "authority": "versioned-contract"
        },
        {
            "id": "architecture-rules-policy",
            "paths": ["governance/architecture-rules.json"],
            "sha256": "a4ac78b20f06efc4b4525370a65fe36295df71e2b03366d2031ec9dd6bfbda86",
            "source": "certified-commit",
            "role": "architecture-policy",
            "authority": "engineering-policy"
        },
        {
            "id": "architecture-authority-policy",
            "paths": [